{
  "assets": {
    "1_Pooling/config.json": "google/embeddinggemma-2/1_Pooling/config.json",
    "2_Normalize/config.json": "google/embeddinggemma-2/2_Normalize/config.json",
    "config.json": "google/embeddinggemma-2/config.json",
    "config_sentence_transformers.json": "google/embeddinggemma-2/config_sentence_transformers.json",
    "modules.json": "google/embeddinggemma-2/modules.json",
    "preprocessor_config.json": "google/embeddinggemma-2/preprocessor_config.json",
    "processor_config.json": "google/embeddinggemma-2/processor_config.json",
    "sentence_bert_config.json": "google/embeddinggemma-2/sentence_bert_config.json",
    "tokenizer.json": "google/embeddinggemma-2/tokenizer.json",
    "tokenizer.model": "google/embeddinggemma-2/tokenizer.model",
    "tokenizer_config.json": "google/embeddinggemma-2/tokenizer_config.json"
  },
  "components": [
    {
      "compute_dtype": "bfloat16",
      "for_model_revision": "914f7f89142e33e77833254d9c9b90c3cef7303b",
      "id": "text",
      "revision": "914f7f89142e33e77833254d9c9b90c3cef7303b",
      "selectors": [
        {
          "file": "google/embeddinggemma-2/model.safetensors",
          "group_regex": "(?:layers|blocks|transformer_blocks)\\.(\\d+)\\.",
          "prefix": "language_model."
        }
      ]
    },
    {
      "compute_dtype": "bfloat16",
      "for_model_revision": "914f7f89142e33e77833254d9c9b90c3cef7303b",
      "id": "vision",
      "revision": "914f7f89142e33e77833254d9c9b90c3cef7303b",
      "selectors": [
        {
          "file": "google/embeddinggemma-2/model.safetensors",
          "group_regex": "(?:layers|blocks|transformer_blocks)\\.(\\d+)\\.",
          "prefix": "vision_tower."
        }
      ]
    },
    {
      "compute_dtype": "bfloat16",
      "for_model_revision": "914f7f89142e33e77833254d9c9b90c3cef7303b",
      "id": "vision_projection",
      "revision": "914f7f89142e33e77833254d9c9b90c3cef7303b",
      "selectors": [
        {
          "file": "google/embeddinggemma-2/model.safetensors",
          "group_regex": "(?:layers|blocks|transformer_blocks)\\.(\\d+)\\.",
          "prefix": "embed_vision."
        }
      ]
    },
    {
      "compute_dtype": "bfloat16",
      "for_model_revision": "914f7f89142e33e77833254d9c9b90c3cef7303b",
      "id": "audio",
      "revision": "914f7f89142e33e77833254d9c9b90c3cef7303b",
      "selectors": [
        {
          "file": "google/embeddinggemma-2/model.safetensors",
          "group_regex": "(?:layers|blocks|transformer_blocks)\\.(\\d+)\\.",
          "prefix": "audio_tower."
        }
      ]
    },
    {
      "compute_dtype": "bfloat16",
      "for_model_revision": "914f7f89142e33e77833254d9c9b90c3cef7303b",
      "id": "audio_projection",
      "revision": "914f7f89142e33e77833254d9c9b90c3cef7303b",
      "selectors": [
        {
          "file": "google/embeddinggemma-2/model.safetensors",
          "group_regex": "(?:layers|blocks|transformer_blocks)\\.(\\d+)\\.",
          "prefix": "embed_audio."
        }
      ]
    }
  ],
  "files": [
    {
      "bytes": 90,
      "format": "asset",
      "path": "google/embeddinggemma-2/1_Pooling/config.json",
      "revision": "914f7f89142e33e77833254d9c9b90c3cef7303b",
      "sha256": "8759bdf7c77efc7df7723f64856a593c8943b71ee38baf2a88771fbaf78438f9",
      "url": "https://huggingface.co/google/embeddinggemma-2/resolve/914f7f89142e33e77833254d9c9b90c3cef7303b/1_Pooling/config.json"
    },
    {
      "bytes": 97,
      "format": "asset",
      "path": "google/embeddinggemma-2/2_Normalize/config.json",
      "revision": "914f7f89142e33e77833254d9c9b90c3cef7303b",
      "sha256": "cdb09dfca347a56aa2d691744e38d5ad3c7cbc2834e7181272b9a15328b82524",
      "url": "https://huggingface.co/google/embeddinggemma-2/resolve/914f7f89142e33e77833254d9c9b90c3cef7303b/2_Normalize/config.json"
    },
    {
      "bytes": 4455,
      "format": "asset",
      "path": "google/embeddinggemma-2/config.json",
      "revision": "914f7f89142e33e77833254d9c9b90c3cef7303b",
      "sha256": "b8f1e9931b57fbc054acdb445c41765d55b0074c58d145fa82839941ad1b5bb3",
      "url": "https://huggingface.co/google/embeddinggemma-2/resolve/914f7f89142e33e77833254d9c9b90c3cef7303b/config.json"
    },
    {
      "bytes": 1565,
      "format": "asset",
      "path": "google/embeddinggemma-2/config_sentence_transformers.json",
      "revision": "914f7f89142e33e77833254d9c9b90c3cef7303b",
      "sha256": "031e56a498d33c349ab489a21885bcfe25b4fcba841149dc99e1e90d4a7c28f5",
      "url": "https://huggingface.co/google/embeddinggemma-2/resolve/914f7f89142e33e77833254d9c9b90c3cef7303b/config_sentence_transformers.json"
    },
    {
      "bytes": 1488915288,
      "format": "safetensors",
      "path": "google/embeddinggemma-2/model.safetensors",
      "revision": "914f7f89142e33e77833254d9c9b90c3cef7303b",
      "sha256": "197a32965d4b1105faf060417baa899e193fb73cd401f42ec9295234d5553d79",
      "url": "https://huggingface.co/google/embeddinggemma-2/resolve/914f7f89142e33e77833254d9c9b90c3cef7303b/model.safetensors"
    },
    {
      "bytes": 413,
      "format": "asset",
      "path": "google/embeddinggemma-2/modules.json",
      "revision": "914f7f89142e33e77833254d9c9b90c3cef7303b",
      "sha256": "3d02572a0455b832de67fb8e63a54981bc7e8b46e337c95e917bd8122a533bfd",
      "url": "https://huggingface.co/google/embeddinggemma-2/resolve/914f7f89142e33e77833254d9c9b90c3cef7303b/modules.json"
    },
    {
      "bytes": 511,
      "format": "asset",
      "path": "google/embeddinggemma-2/preprocessor_config.json",
      "revision": "914f7f89142e33e77833254d9c9b90c3cef7303b",
      "sha256": "ea2ae257e901064abdd98dceb19f2b0da06af600bed15e0f99f5c85c37ee9d78",
      "url": "https://huggingface.co/google/embeddinggemma-2/resolve/914f7f89142e33e77833254d9c9b90c3cef7303b/preprocessor_config.json"
    },
    {
      "bytes": 1788,
      "format": "asset",
      "path": "google/embeddinggemma-2/processor_config.json",
      "revision": "914f7f89142e33e77833254d9c9b90c3cef7303b",
      "sha256": "168f6a08522f3ce5dea596d94d003af2fd691742d4f41fe1f9d8cce76bfbf69c",
      "url": "https://huggingface.co/google/embeddinggemma-2/resolve/914f7f89142e33e77833254d9c9b90c3cef7303b/processor_config.json"
    },
    {
      "bytes": 747,
      "format": "asset",
      "path": "google/embeddinggemma-2/sentence_bert_config.json",
      "revision": "914f7f89142e33e77833254d9c9b90c3cef7303b",
      "sha256": "b1bcd9f2dce3ae863b359e87d0710b5dbc3314a59ecb4e2f97c7778fc8e4b228",
      "url": "https://huggingface.co/google/embeddinggemma-2/resolve/914f7f89142e33e77833254d9c9b90c3cef7303b/sentence_bert_config.json"
    },
    {
      "bytes": 32170510,
      "format": "asset",
      "path": "google/embeddinggemma-2/tokenizer.json",
      "revision": "914f7f89142e33e77833254d9c9b90c3cef7303b",
      "sha256": "4d777ef5bdc1aa36227abdfb77c3e49e7b9c892d16e1b6bda41c393504828be4",
      "url": "https://huggingface.co/google/embeddinggemma-2/resolve/914f7f89142e33e77833254d9c9b90c3cef7303b/tokenizer.json"
    },
    {
      "bytes": 4689013,
      "format": "asset",
      "path": "google/embeddinggemma-2/tokenizer.model",
      "revision": "914f7f89142e33e77833254d9c9b90c3cef7303b",
      "sha256": "e594c8a90eb08d8bda498ff4747977dc827ae0c3c56b5c0d41a605a22d02ef03",
      "url": "https://huggingface.co/google/embeddinggemma-2/resolve/914f7f89142e33e77833254d9c9b90c3cef7303b/tokenizer.model"
    },
    {
      "bytes": 1599,
      "format": "asset",
      "path": "google/embeddinggemma-2/tokenizer_config.json",
      "revision": "914f7f89142e33e77833254d9c9b90c3cef7303b",
      "sha256": "17bd5d6e9364ca49a534e1502076593317c298d4a663623091ed45388f004874",
      "url": "https://huggingface.co/google/embeddinggemma-2/resolve/914f7f89142e33e77833254d9c9b90c3cef7303b/tokenizer_config.json"
    }
  ],
  "model": "google/embeddinggemma-2",
  "profile": "bf16-native-v1",
  "revision": "914f7f89142e33e77833254d9c9b90c3cef7303b",
  "version": 1
}
